{
	"name": "PysparkDataDeliveryBasic",
	"package": "com.boozallen.aiops.mda.basic",
	"type": {
		"name": "data-flow",
		"implementation": "data-delivery-pyspark"
	},
	"dataLineage": false,
	"steps": [
	  {
		"name": "ExampleSyncStep",
		"type": "synchronous",
		"alerting": {
		  "enabled": false
		},
		"provenance": {
		  "enabled": false
		},
		"dataProfiling": {
		  "enabled": false
		}
	  },
	  {
		"name": "ExampleAsyncStep",
		"type": "asynchronous",
		"alerting": {
		  "enabled": false
		},
		"provenance": {
		  "enabled": false
		},
		"dataProfiling": {
		  "enabled": false
		}
	  }
	]
  }